context,question,answer,source_doc,groundedness_score,relevance_score
"40 Chapter 2 • Gathering Information
 And, finally here is sample of a request for new software: 
Requests
CCS Number  User Request Date  Software Reason Response Response Date  Status
2123 Johnson 5/20/2009 Camtasia I am conducting several online classes. 
I need to be able to create visual demos to post to the class Web site We don’t currently have 
a license for Camtasia but will explore acquiring one 5/24/2009 Pending
Job Shadow Report 
 I spent the day on 4/12/2010 following Sheri, a member of the 
software management team at Grandfield College. The first thing she did after settling into her office was check a spread-
sheet that listed pending installations. She showed me the list 
and told me that she had about six installations to do that morn-ing. She also noted that it was the most boring part of her job. “Nothing like watching the progress bar on the monitor for hours at a time,” she said. Next, she checked her emails. There were three requests for additional software. She opened a 
spreadsheet and entered the request information. She told me that she would check later to see if the school had the software 
or if it was something they would have to purchase. If it was a purchase, she would have to get permission. She replied to each of the emails to acknowledge their request. 
 After noting the requests, she looked again at the installa-
tion to be done. She went to a cupboard and pulled out some disks. She told me that some software can be installed from a network drive, but for some she has to bring the media. She 
also grabbed a notebook. We went to the first office. She spoke 
for a few moments with the woman who occupied the office. They laughed at a few things. Sheri said that with luck the  installations should take no more than 30 minutes. The woman left the office to let Sheri work. Sheri logged into the computer 
as  administrator and slipped in a DVD. She started the 
install. 
 I asked her about the notebook. Sheri told me that she","What is one task that a software management team member at Grandfield College does when processing software installation requests?
","A software management team member at Grandfield College checks if the school already has the requested software or if it needs to be purchased, and obtains permission if necessary, before proceeding with the installation",databases/db2.pdf,5,3
"Bill thinks for a moment and then says, “Here is what I usually do: I go through the materials and iden-
tify all the issues with the current system. That helps me get the purpose of the database back in focus. Usually the reason for developing a database is to fix those issues. Next, I look at all the requirements. What exactly does the database need to do? Remember to look at it from each user’s perspective. Then I would go through the materials and identify all the business rules. The rules can give you clues as to what data must be included and how people will use them. Some of it can be incorporated into the database, and some will have to be implemented in the client application that will need to be developed at some point. Does that help?” 
 Sharon replies, “Enormously, I don’t know how to thank you enough.”  Bill laughs, “No problem. Just make a good database.”   CHAPTER 3  
 Requirements and 
Business Rules","What is an important step Bill takes when developing a database?
","When developing a database, Bill first identifies all the issues with the current system to get the purpose of the database back in focus. This step helps him understand the reasons for creating the database and the problems it needs to solve",databases/db2.pdf,5,3
"Chapter 3 • Requirements and Business Rules  47
REQUIREMENTS
 The next thing Bill said to do was to go through her notes again and identify all the 
 requirements, the things the database must do. Once again Sharon returns to the state-ment of work. The Scope section lays out the general requirements clearly: 
  The Tutoring database will manage data for the tutoring program at the col-
lege. It will track available tutors and the courses they can tutor. It will also track each tutor’s tutoring schedule. The database will store demographic information for students who register for tutoring. This information will be private and used only generate general reports which include no personal information. Students, who have registered, will be able to sign up for avail-able tutoring sessions for courses in which they are enrolled. The database will track whether students attended their scheduled sessions. It will also track student requests for tutoring in additional course and subjects.  
 He also noted that she should look at it from different users’ points of view. What does 
the database need to do for the tutor? What does it need to do for Terry? What does it need to do for the student? The next step is to work these requirements out in greater detail. 
Things You Should Know 
Requirements
A database requirement is something the database needs to have or do in order to meet the business 
needs of the organization for which it is being built. For instance, in the Tutoring database, if Terry needs to make reports on student gender and ethnicity, then the database must have attributes that 
store those values. It is a requirement of the database. Another requirement might be that, for legal 
and privacy reasons, the personal data of students must be secured so that only those with valid reasons and permission can view or edit them. 
There are different kinds of database requirements:","What is a database requirement related to legal and privacy reasons in the Tutoring database?
","According to the context, a database requirement related to legal and privacy reasons in the Tutoring database is that the personal data of students must be secured so that only those with valid reasons and permission can view or edit them",databases/db2.pdf,5,4
"and privacy reasons, the personal data of students must be secured so that only those with valid reasons and permission can view or edit them. 
There are different kinds of database requirements: 
•Data requirements . This refers to the attributes the database must contain in order to store all 
the information an organization needs for its activities. To record a point-of-sale transaction, for 
example, the database would need to have attributes for the sale number, the date, the cus-
tomer, the items and quantities purchased, and the prices of those items among others. 
•Report requirements . Most databases need to generate several different kinds of reports, 
summary information often gathered from several different entities. The entities must contain the data needed to make these reports, as mentioned earlier, but also be related in a way that 
makes it possible to bring the various pieces of data together. This is a function of relational 
design which we shall look at in detail in the next chapter. 
•Access and Security Requirements . Often some, or all, of the data in a database are confi-
dential. Databases typically contain core business information that could be of great value of to 
a competitor, or it may contain things such as credit card numbers or social security numbers 
that could pose financial and legal risks if revealed to the wrong people. An essential require-ment of most databases is to develop a security schema that determines who has access to what data. Anyone without the proper authentication credentials should be excluded. 
Chapter 2 looked at most of the techniques for gathering requirements: interviews, questionnaires, 
review of documents, and job shadowing. From those, it is necessary to distill the requirements into a usable list. One of the techniques, used in this chapter, is to look at the requirements in terms of each 
user who will interact with the database. What does the database need to do and contain for that user","What is an essential requirement for most databases to protect confidential data?
",An essential requirement for most databases is to develop a security schema that determines who has access to what data. Anyone without the proper authentication credentials should be excluded to prevent unauthorized access and potential financial and legal risks,databases/db2.pdf,5,5
"user who will interact with the database. What does the database need to do and contain for that user 
to successfully complete his or her tasks? The chapter starts with the higher-level approaches, looking at the general requirements first and then getting down to the detail of what attributes and entities the database needs to contain. This approach can help organize what is admittedly a complex task. 
Finally, it is essential to review the requirements you find with those who will be using the 
database. Having a full understanding of the requirements is crucial if you are to develop a successful 
database. Leaving out requirements, even small ones, may render the entire database useless to the organization. REQUIREMENT 
 Something the database must do in 
order to meet the business needs of an organization.","What is a requirement in the context of a database?
","In the context provided, a requirement is a function or feature that a database must have in order to meet the business needs of an organization. It is a crucial element in developing a successful database, and leaving out even small requirements can potentially render the entire database useless to the organization",databases/db2.pdf,5,5
"48 Chapter 3 • Requirements and Business Rules 
 Thinking about this, Sharon remembers that Professor Collins had told her to 
make sure that she looked at the requirements in terms of each of the stakeholders for the database. That gives her a place to start. First, she will look at the tutors. What does the database have to do for each tutor? She writes out a list: 
   •   Allow tutors to enter their monthly schedules.  
  •   Allow tutors to view the schedule to see for which sessions students have 
signed up.  
  •   Allow tutors to cancel a session.    •   Allow tutors to fill out and submit a session report.   
 She ponders for a moment trying to decide if there is anything else the database has to 
do for tutors. It has to allow their hours to be tracked for payment. But that  requirement seems to belong more to the tutoring administrator. 
 Sharon next decides to list all the requirements she can for students. For them, the 
database must do the following: 
   •   Allow students to register for tutoring (includes entering demographic data and 
current courses).  
  •   Allow students to view session schedule.    •   Allow students to sign up for session.    •   Allow students to cancel a session.   
 Sharon isn’t sure of the last one. Are students allowed to cancel their own sessions? She 
will have to check with Terry when they review the requirements together. 
 Thinking of Terry, Sharon decides to list the requirements for the tutoring admin-
istrator next. For Terry, the database must do the following: 
   •   Allow her to view session schedules.  
  •   Allow her to add and remove tutors.    •   Allow her to add and remove courses.    •   Allow her to view students’ requests.    •   Allow her to view and summarize session reports.   
 Sharon thinks about this for a moment. There are other reports Terry needs to view,","What are some database requirements for the tutoring administrator in the context?
","In the given context, the database must allow the tutoring administrator, named Terry, to view session schedules, add and remove tutors, add and remove courses, view students’ requests, and view and summarize session reports",databases/db2.pdf,5,4
"Sharon thinks about this for a moment. There are other reports Terry needs to view, 
besides just reports on the sessions. And it might be possible that she needs to be able to generate new reports. Sharon adds a few more items to Terry’s list of requirements: 
   •   View and generate reports.  
  •   Summarize tutor hours for payroll.   
 There will be a couple more actors who will be involved in the database. In addition to 
the tutoring administrator, there will need to be a database administrator. He or she will need to maintain the database by backing it up regularly, and will need to maintain its security, especially for student information. IT staff members will need to make the database available over the network and secure access to it. Sharon decides not to list these for the moment. 
 Another set of requirements involves access and security. Sharon knows that she 
will have to fully develop these in the database itself, but for now she just makes a few notes. First, she looks at the access requirements for Terry: 
   •   The database administrator should have select access to all the data. That means 
he or she can view all the data in the tables.  
  •   The database administrator needs to be able to add, edit, and remove records for 
tutors and courses.  
  •   The database administrator should be able to create queries as needed.    •   The database administrator should not be able to create or remove tables or other 
database objects.   
 The last one she will have to check with Terry, but her basic instinct is that no one 
 except the database administrator should be able to add or remove database objects.     
 Caution 
 It is essential that you include security considerations in your","Who should have select access to all the data in the database?
","According to the context, the database administrator should have select access to all the data in the database, which means he or she can view all the data in the tables",databases/db2.pdf,3,4
"except the database administrator should be able to add or remove database objects.     
 Caution 
 It is essential that you include security considerations in your 
planning from the beginning. Too often developers wait until after the database has been designed and developed to think about the security issues of a database. Adding security as an afterthought can result in an insecure database, vulnerable to data theft or to accidental violations that can result in a loss of data integrity.","What is a potential issue with adding security considerations to a database as an afterthought?
","Adding security as an afterthought to a database can result in an insecure database, vulnerable to data theft or to accidental violations that can result in a loss of data integrity. It is essential to include security considerations in the planning from the beginning to ensure the database is secure and protected",databases/db2.pdf,3,5
"Chapter 3 • Requirements and Business Rules  49
  Next, she thinks about the tutor: 
   •   A tutor needs to be able to enter and edit his or her own schedules but no 
one else’s.  
  •   A tutor needs to be able to enter a session report.    •   A tutor needs to be able to cancel one of his or her own sessions, but no one else’s.    •   A tutor should not be able to see student information.   
 Lastly, she looks at students: 
   •   A student must be able to view all available sessions.  
  •   A student must be able to enter his or her own demographic information.    •   A student must be able to enter the courses in which he or she is currently 
enrolled.
  •   A student should be able to cancel one of his or her own sessions, but no one else’s.   
Things You Should Know 
Access and Security 
Security involves determining who has access to database objects and data and what kind of access 
they should have. The following table lists some of the types of access a user can have. Each type of access also represents a set of SQL commands. SQL will be covered in more detail in Chapter 7 and 
Security in Chapter 8. USER ACCESS 
 It refers to what objects and data 
in a database a user has permission to use. THINGS TO THINK ABOUT 
For the moment, disregard any malicious intent 
by a user. What do you think would happen to the data in a database if every user could access 
and change every other user’s data? 
 Sharon makes a list of all the requirements she has identified. 
 The database must do the following: 
   •   Allow tutors to enter their monthly schedules.","What kind of data can a tutor modify in the database?
","In the given context, a tutor can enter and edit his or her own schedules, submit session reports, and cancel his or her own sessions. However, a tutor should not be able to see student information or modify any data related to other tutors or students",databases/db2.pdf,5,4
"and change every other user’s data? 
 Sharon makes a list of all the requirements she has identified. 
 The database must do the following: 
   •   Allow tutors to enter their monthly schedules.  
  •   Allow tutors to view the schedule to see which sessions have students signed up.    •   Allow tutors to cancel a session.    •   Allow tutors to fill out and submit a session report.    •   Track and summarize tutor hours.    •   Track and summarize student demographic data.    •   Track and summarize tutoring sessions by subject area.    •   Allow the administrator to view session schedules.    •   Allow the administrator to add and remove tutors.  Table 3-1 Types of Database Permissions 
Type of Access  Description
Create The permission to make new database objects such as tables or views 
Alter The permission to modify database objects Drop The permission to remove database objects Select The permission to see data in a table or view 
Update The permission to modify data in a table 
Insert The permission to add data rows to a table Delete The permission to remove data rows from a table 
Execute The permission to run database executables such as stored procedures","What permissions are needed for tutors to enter their monthly schedules in the database?
","Tutors need the ""Insert"" permission to add data rows to the table that stores the monthly schedules in the database. This permission allows them to enter their schedules and update them as needed",databases/db2.pdf,3,4
"50 Chapter 3 • Requirements and Business Rules 
  •   Allow the administrator to add and remove courses.  
  •   Allow the administrator to view student requests.    •   Allow the administrator to view and summarize session reports.    •   Allow students to register for tutoring (includes demographic data and current 
courses).
  •   Allow students to view session schedule.    •   Allow students to sign up for session.    •   Allow students to cancel a session.    •   Secure student demographic information.   
 Sharon looked over her requirements. Do they provide the data needed to resolve all 
the issues she had identified? It should be easier for Terry to get demographic informa-tion. Most students will enter it, and those who don’t will need to at least enter their student ID. That will make it easier to look them up on the school’s system. The Session entity data should make it easy to track tutor’s hours and the session usage. It should also make it much easier for students to locate appropriate sessions by time, class, and tutor. She isn’t sure it will help with the sessions running over time, but the database should solve most of the issues.  
BUSINESS RULES 
 Sharon is starting to feel a little better. Listing the requirements is a big step toward being able to design the database. Next, she needs to list the business rules. Business rules, she knows, are rules about how the data are captured and used and what limits or constraints are placed on the data. Some of these rules can be enforced in the data-base, and some will need to be built into the client application that is built on the  database. Once again, she looks through her notes.   
Things You Should Know 
Business Rules 
Business rules describe the rules that govern the way data are acquired, stored, and used by the","What is the purpose of business rules in the context of database design?
","In the context of database design, business rules describe the rules that govern the way data are acquired, stored, and used by the system. Some of these rules can be enforced in the database itself, while others will need to be built into the client application that is built on top of the database. These rules are crucial for ensuring data integrity, consistency, and security",databases/db2.pdf,3,5
"Things You Should Know 
Business Rules 
Business rules describe the rules that govern the way data are acquired, stored, and used by the 
business. They are important for a database developer, who must make sure the database he or she develops can support all the business rules and operations. Some of the business rules can be 
enforced directly in the database. For instance, consider a database to track students’ grades and 
grade-point averages. If the school is on a 4-point system, most databases will support putting a “constraint” on the grade column that limits the value to a number between 0.0 and 4.0. A data-base developer can also limit the length of a column. If all states are to be represented by the two-letter abbreviation, then the length of the column can be set to two. There are several other ways 
to enforce rules within the database as well. But some kinds of rules require extra-programming to 
enforce. If a library has a limit of 20 items out at a time, for instance, there is no way to enforce this rule in the data table. It is possible though to create a “trigger,” which will query the database every time someone checks out an item to see how many items are currently out. It can then flag 
or block a checkout if it exceeds the number of items. (We will talk more about triggers and proce-
dures in chapter 8.) Still other business rules can only be enforced in the client application through which users will interact with the database. 
 First, Sharon knows the database is going to create a couple of new rules: Students 
must register for tutoring, and they must enter their current courses. As part of that registration, students will be encouraged to enter their demographic information. As Sharon understands it, they can’t be forced to enter it, but she will check back with Terry. Students must be registered in the courses they want to be tutored for. Those are some of the business rules that apply specifically to students.","How can business rules related to data acquisition, storage, and usage be enforced in a database?
","Business rules can be enforced directly in a database through constraints, such as limiting the value of a 'grade' column to a number between 0.0 and 4.0 on a 4-point system, or setting the length of a column, like limiting the state abbreviation column to two characters. Additionally, triggers can be created to query the database and flag or block actions that exceed predefined limits, such as the number of items checked out from a library. However, some business rules can only be enforced in the client application, such as requiring students to register for tutoring and enter their current courses before they can receive tutoring services",databases/db2.pdf,3,5
"Stevens, Robert   4  5.5  9.5  $ 10.50  $  99.75 
  Totals    19.5    28.5    48    $ 504.00  
  The main thing the database needs to provide for is the tutor name or ID and the 
hours worked grouped by week, month, and year. Sharon remembers that as a rule, you should not store calculated fields in a database. You can always recreate the calcu-lation in a query, and it will be more accurate because it is based on live data. The hours per week and the total hours can be calculated from the number of sessions a tutor has on the schedule. 
 The form that Terry bases her reports on also contains a great deal of summarized 
information.   
 For a moment, she ponders the word “unduplicated.” But, “unduplicated” is an 
adjective rather than a noun. It is describing something in the database, not a new ele-ment in itself. But “gender,” “ethnicity,” “workforce retraining,” and “subject area” can count as nouns. Time also crops up again in terms of “Fall Term 2010.” That implies “quarter” and “year.”   
 Sharon listens carefully to the notes she recorded during her interview with the 
tutors and students. Many of the same nouns show up. Sharon notes the noun  Caution 
 It is easy to get the data attributes confused with the 
attributes themselves. An attribute is a general descriptor of an entity. For instance, “Last Name” would be an attribute of a Customer entity, but “John Smith” is a type of data that would be stored in that attribute. Attributes are the column heads that describe the data. One way to think of it is that on a computerized form, the attributes are in the labels and the data are what are entered into the textboxes.","What is the difference between an attribute and data in a database?
","In a database, an attribute is a general descriptor of an entity, such as ""Last Name"" for a Customer entity. Data, on the other hand, is the specific information that is stored in that attribute, like ""John Smith"" in the ""Last Name"" attribute. Attributes are the column heads that describe the data, while data is what is entered into the textboxes in a computerized form",databases/db2.pdf,5,5
